{
  "format": "gdd-design-review/0.3",
  "spec_revision": "sha256:fee6a315acc673e367d0a65c32ec8d2aa59e002ee76b33700e764162ca8fc62f",
  "implementation": "implementation.reservations",
  "code_revision": "sha256:12579f6b89d1bf9eb00ebbdfec0daaf4c7b7f19c82cbe69e02ba1993ea95559f",
  "scope": [
    "component.reservations"
  ],
  "reviewer": {
    "name": "actor.independent-agent",
    "version": "installed-skill-cold-start-1"
  },
  "executed": true,
  "assessments": [
    {
      "principle": "kiss",
      "status": "reviewed",
      "rationale": "One stateful object and two direct functions implement the current requirements with no extra layer. Reviewed action.reserve/action.cancel and entity.reservation at reservation.py:L5-L20 and fixed assertions at test_reservation.py:L7-L80.",
      "findings": []
    },
    {
      "principle": "dry",
      "status": "reviewed",
      "rationale": "Each function owns its distinct transition. Similar guard syntax is small, local and does not duplicate a separately authoritative external policy. Reviewed action.reserve/action.cancel and entity.reservation at reservation.py:L5-L20 and fixed assertions at test_reservation.py:L7-L80.",
      "findings": []
    },
    {
      "principle": "separation_of_concerns",
      "status": "reviewed",
      "rationale": "reservation.py owns lifecycle decisions and mutations; test_reservation.py verifies them. The module introduces no excluded persistence, network, permission or concurrency responsibility. Reviewed action.reserve/action.cancel and entity.reservation at reservation.py:L5-L20 and fixed assertions at test_reservation.py:L7-L80.",
      "findings": []
    },
    {
      "principle": "modularity",
      "status": "reviewed",
      "rationale": "Callers use reserve and cancel through the owning component contracts. The observed reserve signature and required identity behavior remain stable. The bounded API intentionally exposes mutable in-memory state. Reviewed action.reserve/action.cancel and entity.reservation at reservation.py:L5-L20 and fixed assertions at test_reservation.py:L7-L80.",
      "findings": []
    }
  ]
}
