{
  "format": "gdd-design-review/0.3",
  "spec_revision": "sha256:6e63e184d19f87e79056d66d9922c3d7dbbd62db481f50e59d5f194fbe7d1ab9",
  "implementation": "implementation.concert.sqlite",
  "code_revision": "sha256:411bb341b635150210493248ddfd889dbdf6ea7283f862f728a69b72ef34b53f",
  "scope": [
    "action.reserve",
    "action.cancel",
    "action.catalog",
    "action.list_own_reservations",
    "screen.reserve",
    "component.api",
    "action.login",
    "action.logout",
    "action.current_session"
  ],
  "reviewer": {
    "name": "actor.concert.lead",
    "version": "1"
  },
  "executed": true,
  "assessments": [
    {
      "principle": "kiss",
      "status": "reviewed",
      "rationale": "Five explicit components serve present transport, identity, reservation, persistence and presentation duties. Standard-library HTTP and SQLite avoid plugin abstractions and runtime dependencies for this bounded app.",
      "findings": []
    },
    {
      "principle": "dry",
      "status": "reviewed",
      "rationale": "Reservations owns the policy and ordered business decisions. Storage counts rows rather than maintaining duplicate seat counters. Frontend reads active_limit and active_count from the public contract.",
      "findings": []
    },
    {
      "principle": "separation_of_concerns",
      "status": "reviewed",
      "rationale": "SQL is restricted to Storage; credential/session registry is in Identity; transport derives the principal and calls Reservations. Actual AST scan and foreign-cancellation HTTP tests support these boundaries.",
      "findings": []
    },
    {
      "principle": "modularity",
      "status": "reviewed",
      "rationale": "Independent agents implemented frontend and backend against frozen public HTTP/Python contracts. Actual combined tests demonstrate integration; component boundaries include short responsibility/rationale/exclusions.",
      "findings": []
    }
  ]
}
